<?xml version="1.0" encoding="UTF-8"?>
<!-- <!DOCTYPE mancala SYSTEM "GameState.dtd"> -->

<game>
    <board>
        <layer position="top">
            <house id="1">1</house>
            <house id="2">2</house>
            <house id="3">3</house>
            <house id="4">4</house>
            <house id="5">5</house>
            <house id="6">6</house>
            
            <store id="7">20</store>
        </layer>
        
        <layer position="bottom">
            <house id="8">12</house>
            <house id="9">11</house>
            <house id="10">10</house>
            <house id="11">9</house>
            <house id="12">8</house>
            <house id="13">7</house>
            
            <store id="14">10</store>
        </layer>
    </board>
    
    <players>
        <turn>1</turn>
        
        <player>
            <id>1</id>
            <winCount>2</winCount>
        </player>
        
        <player>
            <id>2</id>
            <winCount>0</winCount>
        </player>
    </players>
</game>