<?xml version="1.0" encoding="UTF-8"?>


<!DOCTYPE game SYSTEM "./gamestate.dtd">
<?xml-stylesheet href="transform.xsl" type="text/xsl"?>
<game>
    <board>
        <layer position="top">
            <house id="1">3</house>
            <house id="2">3</house>
            <house id="3">3</house>
            <house id="4">3</house>
            <house id="5">3</house>
            <house id="6">3</house>
            
            <store id="7">0</store>
        </layer>
        
        <layer position="bottom">
            <house id="8">3</house>
            <house id="9">3</house>
            <house id="10">3</house>
            <house id="11">3</house>
            <house id="12">3</house>
            <house id="13">3</house>
            
            <store id="14">0</store>
        </layer>
    </board>
    
    <players>
        <turn>1</turn>
        
        <player>
            <id>1</id>
            <winCount>2</winCount>
        </player>
        
        <player>
            <id>2</id>
            <winCount>0</winCount>
        </player>
    </players>
</game>
